{
  "schema_version": "1.1",
  "event_id": "eaf:run-m0:2",
  "project": "Example-Org/Example-Repo",
  "source": "eaf",
  "source_ref": {
    "run_id": "run-m0",
    "work_packet_id": "wp-m0"
  },
  "kind": "milestone",
  "payload": {
    "milestone_id": "M0",
    "action": "started"
  },
  "occurred_at": "2026-06-07T10:00:00Z"
}
