{
  "schema_version": "1.0",
  "event_id": "eaf:run-abc123:1",
  "project": "Example-Org/Example-Repo",
  "source": "eaf",
  "source_ref": {
    "run_id": "run-abc123",
    "work_packet_id": "wp-1"
  },
  "kind": "progress",
  "payload": {
    "phase_event": "started",
    "title": "Run started"
  },
  "occurred_at": "2026-05-29T10:00:00Z",
  "content_checksum": "b1946ac92492d2347c6235b4d2611184"
}