{
  "schema_version": "1.0",
  "event_id": "eaf:run-abc123:2",
  "project": "Example-Org/Example-Repo",
  "source": "eaf",
  "source_ref": {
    "run_id": "run-abc123",
    "work_packet_id": "wp-1"
  },
  "kind": "progress",
  "payload": {
    "phase_event": "stage_advanced",
    "title": "Validation harness dispatched",
    "detail": "L2.1 sweep",
    "pr_url": "https://github.com/Example-Org/Example-Repo/pull/100",
    "commit_sha": "082eb41"
  },
  "occurred_at": "2026-05-29T10:00:00Z"
}