{
  "schema_version": "1.0",
  "event_id": "eaf:run-abc123:10",
  "project": "Example-Org/Example-Repo",
  "source": "eaf",
  "source_ref": {
    "run_id": "run-abc123",
    "work_packet_id": "wp-1"
  },
  "kind": "handoff",
  "payload": {
    "manual_path": "/Users/x/proj/HANDOFF.md",
    "generated_by": "eaf-handoff"
  },
  "occurred_at": "2026-05-29T10:00:00Z"
}