{
  "schema_version": "1.0",
  "event_id": "eaf:run-abc123:3.defect.1",
  "project": "Example-Org/Example-Repo",
  "source": "eaf",
  "source_ref": {
    "run_id": "run-abc123",
    "work_packet_id": "wp-1"
  },
  "kind": "defect",
  "payload": {
    "defect_id": "F-1",
    "action": "opened",
    "title": "Null deref in collect",
    "severity": "high"
  },
  "occurred_at": "2026-05-29T10:00:00Z"
}